{
  "schemaVersion": "1.0.0",
  "kind": "batch",
  "sessionId": "session-2026-07-18-p520",
  "batchIndex": 0,
  "verdicts": [
    { "kind": "ADD", "nodeId": "node-decision-001" },
    { "kind": "UPDATE", "nodeId": "node-decision-000" },
    { "kind": "DELETE", "edgeId": "edge-stale-007" }
  ],
  "emittedAt": "2026-07-18T10:00:00Z",
  "byWhom": { "identity": "second-brain-fold:worker", "role": "extractor" }
}
